{
    "schemaVersion": "waar-legacy-reference/0.1",
    "reference": {
        "id": "waar-v2-legacy-aggregate-current",
        "rulesetVersion": "waar-v2-legacy-infirmary-5",
        "resolutionModel": "legacy-aggregate-v2",
        "sourceFingerprint": "221ae93e8488fd3dfacb6b3d010aa0304e881eba0f0372bbdd62002fa5bfd6f4",
        "sourceFiles": [
            {
                "path": "src/Game/Army/UnitType.php",
                "sha256": "0817425b296d72c37f194222985f41f1f1adbaad63be1e08f5fce62709e91836"
            },
            {
                "path": "src/Game/Combat/CombatArmy.php",
                "sha256": "ba41174188e1f4a33d4bac8541ea9b314f4a91b4a3a329bca8abd930a3f93956"
            },
            {
                "path": "src/Game/Combat/LegacyAggregateCombatResolver.php",
                "sha256": "b4e0387a7649fd79950013511509004c02e116527ca0a6b4ec17594ac164e9d8"
            },
            {
                "path": "src/Game/Combat/UnitCohort.php",
                "sha256": "86e44a52ea96c08b5c05c41d2472250e395da244237b25dd646489c2eef70e60"
            },
            {
                "path": "src/Game/Combat/UnitState.php",
                "sha256": "2b5b7bdcd0ac6d6e4762b053be439b8360f38dfc5c09bc1b22ac58cee5f9165a"
            },
            {
                "path": "src/Game/Combat/Numeric/CombatFixedPoint.php",
                "sha256": "9306ce258ffad5d5e6d5fe335e032cc52ac7ea23efda4db6067872f57d1bef18"
            },
            {
                "path": "src/Game/Combat/Rules/CombatRuleset.php",
                "sha256": "106f773ce435a786e9562390964ca7da547834011b6ebd80c55c7f362247a3bb"
            },
            {
                "path": "src/Game/Combat/Rules/LegacyCombatRuleset.php",
                "sha256": "6c8258b6fa6f054a89f5cd5dd41ddc35ef50c4ef7d6b24f3a75e2e4dcde6e60d"
            },
            {
                "path": "src/Game/Combat/Rules/LegacyAggregateParameters.php",
                "sha256": "3551db6476e715ea6f62a2cb7c98ea755bcb8ac8129ac24f7e49d80933adcd6f"
            },
            {
                "path": "src/Game/Combat/Rules/UnitDefinition.php",
                "sha256": "1a7817bf519ca897ca2446edc2338a416943ab1a72314f2b4c48d98902ac8797"
            },
            {
                "path": "src/Game/Random/SeededRandomSource.php",
                "sha256": "514114e14376d1f1080b82f506f1970c3f8f641f0adf16da48284d23252c76a7"
            },
            {
                "path": "src/Game/Combat/Research/LegacyOperationalProjection.php",
                "sha256": "a7da468da041a6185aa0171b6a63eadd036e6da14958e7e7aa2046025aa0d937"
            },
            {
                "path": "src/Game/Combat/Research/LegacyReferenceExporter.php",
                "sha256": "382eb85d7136e3a32d72ea981be3871013d10c473e1fc3397698ad1a22daadc8"
            }
        ]
    },
    "corpus": {
        "experimentSchemaVersion": "waar-micro-wind-tunnel/0.1",
        "experimentId": "t24-astra-vector-corrections",
        "fingerprint": "f9285586b585c9db9e4d88cb3756885a7af9e12fba0a072c8033e675f4474ce4",
        "scenarioCount": 6,
        "scenarios": [
            {
                "id": "soldier-control",
                "label": "Soldats seuls — témoin de stabilité",
                "focusSide": "attacker",
                "attacker": {
                    "soldier": 30,
                    "spearman": 0,
                    "archer": 0,
                    "knight": 0
                },
                "defender": {
                    "soldier": 30,
                    "spearman": 0,
                    "archer": 0,
                    "knight": 0
                }
            },
            {
                "id": "spearman-screen",
                "label": "Écran de Lanciers en défense",
                "focusSide": "defender",
                "attacker": {
                    "soldier": 22,
                    "spearman": 0,
                    "archer": 8,
                    "knight": 0
                },
                "defender": {
                    "soldier": 20,
                    "spearman": 8,
                    "archer": 0,
                    "knight": 0
                }
            },
            {
                "id": "spears-against-knights",
                "label": "Lanciers contre Chevaliers",
                "focusSide": "defender",
                "attacker": {
                    "soldier": 12,
                    "spearman": 0,
                    "archer": 0,
                    "knight": 10
                },
                "defender": {
                    "soldier": 12,
                    "spearman": 18,
                    "archer": 0,
                    "knight": 0
                }
            },
            {
                "id": "archers-against-spears",
                "label": "Archers contre Lanciers",
                "focusSide": "attacker",
                "attacker": {
                    "soldier": 12,
                    "spearman": 0,
                    "archer": 22,
                    "knight": 0
                },
                "defender": {
                    "soldier": 12,
                    "spearman": 18,
                    "archer": 0,
                    "knight": 0
                }
            },
            {
                "id": "knights-against-archers",
                "label": "Chevaliers contre Archers",
                "focusSide": "attacker",
                "attacker": {
                    "soldier": 10,
                    "spearman": 0,
                    "archer": 0,
                    "knight": 10
                },
                "defender": {
                    "soldier": 10,
                    "spearman": 0,
                    "archer": 18,
                    "knight": 0
                }
            },
            {
                "id": "mixed-armies",
                "label": "Armées mixtes",
                "focusSide": "attacker",
                "attacker": {
                    "soldier": 18,
                    "spearman": 8,
                    "archer": 8,
                    "knight": 4
                },
                "defender": {
                    "soldier": 18,
                    "spearman": 8,
                    "archer": 8,
                    "knight": 4
                }
            }
        ]
    },
    "context": {
        "id": "neutral-duel-v1",
        "modifiers": {
            "attacker": {},
            "defender": {}
        },
        "consequenceScope": "post-duel-pre-hospital-operational",
        "hospitalTreatmentIncludedInMetrics": false
    },
    "sampling": {
        "baseSeed": 42,
        "repetitions": 200,
        "seedDerivationId": "sha256-scenario-iteration-first31-v1",
        "randomSourceId": "lcg31-normal-approximation-v1",
        "crossEnginePairingClaimed": false,
        "winnerIsDeterministicAtFixedCompositionAndContext": true
    },
    "comparisonProfile": {
        "id": "operational-common-value-v1",
        "valuationId": "t24-common-valuation-v1",
        "valuation": {
            "soldier": 80,
            "spearman": 110,
            "archer": 130,
            "knight": 350
        },
        "operationalProjection": "Legacy category valid after duel; wounded and dead are raw losses; hospital treatment is excluded.",
        "metrics": {
            "winRate": "Wins divided by all repetitions, draws included in the denominator.",
            "operationalSurvivorsRatio": "Sum of valid units after the duel divided by initial units times repetitions.",
            "operationalEconomicValueRatio": "Sum of valid units weighted by the common valuation divided by initial common value times repetitions."
        },
        "legacyAvailability": {
            "operationalSurvivorsRatio": true,
            "operationalEconomicValueRatio": true,
            "structureRatio": false
        }
    },
    "rows": [
        {
            "scenarioId": "soldier-control",
            "scenarioLabel": "Soldats seuls — témoin de stabilité",
            "side": "attacker",
            "isFocusSide": true,
            "repetitions": 200,
            "wins": 0,
            "draws": 0,
            "initial": {
                "byType": {
                    "soldier": 30,
                    "spearman": 0,
                    "archer": 0,
                    "knight": 0
                },
                "count": 30,
                "commonValue": 2400
            },
            "aggregates": {
                "operationalByType": {
                    "soldier": 5910,
                    "spearman": 0,
                    "archer": 0,
                    "knight": 0
                },
                "rawLossesByType": {
                    "soldier": 90,
                    "spearman": 0,
                    "archer": 0,
                    "knight": 0
                },
                "woundedByType": {
                    "soldier": 90,
                    "spearman": 0,
                    "archer": 0,
                    "knight": 0
                },
                "deadByType": {
                    "soldier": 0,
                    "spearman": 0,
                    "archer": 0,
                    "knight": 0
                }
            },
            "winRate": {
                "numerator": 0,
                "denominator": 200,
                "value": 0,
                "averageAbsolute": 0
            },
            "metrics": {
                "operationalSurvivorsRatio": {
                    "numerator": 5910,
                    "denominator": 6000,
                    "value": 0.985,
                    "averageAbsolute": 29.55,
                    "initialAbsolute": 30
                },
                "operationalEconomicValueRatio": {
                    "numerator": 472800,
                    "denominator": 480000,
                    "value": 0.985,
                    "averageAbsolute": 2364,